{
  "schema": "brownfield-epic-signal-ledger/v1",
  "provenance": {
    "source": "rally",
    "formatted_id": "E6104",
    "object_version": 15,
    "last_update_date": "2026-06-21"
  },
  "summary": {
    "value": "a loan origination monolith on Tomcat 8 lift-and-shifted to EC2",
    "epic_span": "a loan origination monolith on Tomcat 8 lift-and-shifted to EC2"
  },
  "modernization_scope": {
    "value": "all four integrations are in scope full app refactor",
    "epic_span": "all four integrations are in scope full app refactor"
  },
  "integrations": [
    {
      "int_id": "INT-001",
      "name": "Applicant portal",
      "filled": 8,
      "expected_slots": 8,
      "confidence": 1.0,
      "needs_review": false,
      "fields": {
        "technology": {
          "value": "Spring MVC 4 on Tomcat 8",
          "epic_span": "Spring MVC 4 on Tomcat 8"
        },
        "type": {
          "value": "sync api",
          "epic_span": "sync api"
        },
        "direction": {
          "value": "bidirectional",
          "epic_span": "bidirectional"
        },
        "criticality": {
          "value": "high",
          "epic_span": "high"
        },
        "coexistence": {
          "value": "hard-cutover",
          "epic_span": "hard-cutover"
        },
        "api_surface": {
          "value": "internal pages",
          "epic_span": "internal pages"
        },
        "state": {
          "value": "session sticky",
          "epic_span": "session sticky"
        },
        "volume_sla": {
          "value": "800K sessions/day p95 < 700ms",
          "epic_span": "800K sessions/day p95 < 700ms"
        }
      },
      "target_intent": {
        "value": "React SPA on CloudFront",
        "epic_span": "React SPA on CloudFront"
      }
    },
    {
      "int_id": "INT-002",
      "name": "Origination core",
      "filled": 8,
      "expected_slots": 8,
      "confidence": 1.0,
      "needs_review": false,
      "fields": {
        "technology": {
          "value": "Spring Boot 2 monolith",
          "epic_span": "Spring Boot 2 monolith"
        },
        "type": {
          "value": "sync api",
          "epic_span": "sync api"
        },
        "direction": {
          "value": "bidirectional",
          "epic_span": "bidirectional"
        },
        "criticality": {
          "value": "critical",
          "epic_span": "critical"
        },
        "coexistence": {
          "value": "dual-read",
          "epic_span": "dual-read"
        },
        "api_surface": {
          "value": "internal REST documented",
          "epic_span": "internal REST documented"
        },
        "state": {
          "value": "stateful",
          "epic_span": "stateful"
        },
        "volume_sla": {
          "value": "2M requests/day p95 < 500ms",
          "epic_span": "2M requests/day p95 < 500ms"
        }
      },
      "target_intent": {
        "value": "Spring Boot services on ECS",
        "epic_span": "Spring Boot services on ECS"
      }
    },
    {
      "int_id": "INT-003",
      "name": "Credit bureau API",
      "filled": 8,
      "expected_slots": 8,
      "confidence": 1.0,
      "needs_review": false,
      "fields": {
        "technology": {
          "value": "Apigee client v1 cross-cloud",
          "epic_span": "Apigee client v1 cross-cloud"
        },
        "type": {
          "value": "sync api",
          "epic_span": "sync api"
        },
        "direction": {
          "value": "read-only",
          "epic_span": "read-only"
        },
        "criticality": {
          "value": "high",
          "epic_span": "high"
        },
        "coexistence": {
          "value": "dual-read",
          "epic_span": "dual-read"
        },
        "api_surface": {
          "value": "OpenAPI 3.0 documented",
          "epic_span": "OpenAPI 3.0 documented"
        },
        "state": {
          "value": "stateless",
          "epic_span": "stateless"
        },
        "volume_sla": {
          "value": "600K calls/day p95 < 400ms",
          "epic_span": "600K calls/day p95 < 400ms"
        }
      },
      "target_intent": {
        "value": "Apigee GCP client cross-cloud",
        "epic_span": "Apigee GCP client cross-cloud"
      }
    }
  ],
  "nfrs": [
    {
      "value": "comply with SOX and GLBA controls",
      "kind": "nfr",
      "epic_span": "comply with SOX and GLBA controls"
    }
  ]
}